{
  "source_id": "S-0004",
  "source_type": "educational_institution",
  "technical_authority": true,
  "title": "Challenging Patterns — EM4582",
  "author": "Dorothy A. Ettl, Extension Clothing Specialist; Diane S. Triplett, Home Economics Assistant",
  "publisher": "Washington State University Cooperative Extension and the U.S. Department of Agriculture",
  "edition": "Reprinted June 1990 (subject code 832)",
  "year": 1990,
  "isbn": null,
  "url": "https://rex.libraries.wsu.edu/view/pdfCoverPage?instCode=01ALLIANCE_WSU&filePid=13333014070001842&download=true",
  "verification_level": "fulltext",
  "locator": "EM4582, bölüm 'FITTING': uyumun beş temel noktası — Grain, Line, Ease, Balance, Overall smoothness",
  "accessed_on": "2026-08-28",
  "used_for": [
    "C-B ease yorumu: 'kıvrım hâlindeki kırışıklık = fazla ease, çeken kırışıklık = az ease' (BİREBİR)",
    "C-H çözgü/denge: boy çözgüsü yere dik, en çözgüsü yere paralel (BİREBİR)",
    "Bölüm 5 gözlem, Bölüm 7 kıvrım/çekme ayrımı"
  ],
  "superseded_by": null,
  "license_constraint": null,
  "acquisition_status": "public_access",
  "notes": "Bu kaynak, projenin EN ÇOK KULLANILAN kuralının (fazlalık mı yetersizlik mi) kurumsal karşılığıdır. Belge 4-H proje kitapçığıdır; uyum bölümü kısa ama açıktır. ⚠ FAZ 4 ATIF DÜZELTMESİ: belge tam metin (8 sayfa) yeniden okundu. Uyum içeriğinin TAMAMI tek sayfada beş maddedir. CC-22 (kıvrım ekseni), CC-24 (çekme çizgisi) ve CC-29 (etek ucu türevdir) bu belgede YOKTUR ve atıflar KALDIRILDI. Belge CC-23 ve CC-26'yı birebir taşır ve orada kalır. WSU'nun bu konuda yayımladığı asıl belge (E.M. 2246, 'Garment Fitting', 1962) henüz edinilmedi — EXTERNAL_DEPENDENCIES D-10."
}