{
  "source_id": "S-0008",
  "source_type": "educational_institution",
  "technical_authority": true,
  "title": "Fit for Fashion: Refitting and Altering — E-421",
  "author": "Bernetta Kahabka, Extension Clothing",
  "publisher": "Michigan State University Extension Service (MSU Extension Publication Archive, courtesy of the Michigan State University Library)",
  "edition": "Issued September 1967, 4 pages",
  "year": 1967,
  "isbn": null,
  "url": "https://sanweb.lib.msu.edu/DMC/extension_publications/e421/e421.pdf",
  "verification_level": "official_web",
  "locator": null,
  "accessed_on": "2026-08-28",
  "used_for": [
    "Faz 2'de yeniden değerlendirilecek aday kaynak — düzeltme yöntemleri"
  ],
  "superseded_by": null,
  "license_constraint": null,
  "acquisition_status": "acquired",
  "notes": "S-0007 ile aynı sınır: taranmış görüntü, metin katmanı yok. Yükseltme kanıtı olarak KULLANILAMAZ."
}
