{
  "source_id": "S-0007",
  "source_type": "educational_institution",
  "technical_authority": true,
  "title": "Fit for Fashion: The \"A-B-C's\" — E-419",
  "author": "Bernetta Kahabka, Extension Clothing",
  "publisher": "Michigan State University Extension Service (MSU Extension Publication Archive, courtesy of the Michigan State University Library)",
  "edition": "Issued September 1963, 2 pages",
  "year": 1963,
  "isbn": null,
  "url": "https://sanweb.lib.msu.edu/DMC/extension_publications/e419/e419.pdf",
  "verification_level": "official_web",
  "locator": null,
  "accessed_on": "2026-08-28",
  "used_for": [
    "Faz 2'de yeniden değerlendirilecek aday kaynak — uyum temelleri"
  ],
  "superseded_by": null,
  "license_constraint": null,
  "acquisition_status": "acquired",
  "notes": "KÜNYE OKUNDU, İÇERİK OKUNMADI: PDF taranmış GÖRÜNTÜDÜR, metin katmanı YOKTUR. Yalnızca arşiv kapak sayfası makine-okunur. Bu yüzden verification_level 'official_web'te tutuldu ve HİÇBİR kaydı yükseltmek için kullanılamaz (fulltext/official_pdf değil). Ayrıca arşiv kopyası kendi kapağında 'do not use for current recommendations' uyarısı taşır."
}
